{
  "application_id": "APP-2026-00194",
  "product_code": "UG",
  "submitted_at": "2026-07-15T14:43:00",
  "channel": "partner",
  "requested_amount": 57171.54,
  "loan_purpose": "undergraduate_tuition",
  "state_of_residence": "VA",
  "has_cosigner": true,
  "status": "DECISIONED",
  "borrower": {
    "borrower_id": "BORR-00194",
    "first_name": "Jaya",
    "last_name": "Holt",
    "dob": "2004-01-25",
    "age": 22,
    "ssn_itin_masked": "XXX-XX-0194",
    "email": "jaya.holt194@example.com",
    "phone": "(761) 898-3977",
    "address_line1": "8156 Maple Way",
    "city": "Arlington",
    "state": "VA",
    "zip": "71130",
    "citizenship_status": "US_CITIZEN",
    "years_at_address": 1,
    "references_provided": 2
  },
  "cosigner": {
    "cosigner_id": "COSIG-00194",
    "borrower_id": "BORR-00194",
    "relationship": "parent",
    "first_name": "Quinn",
    "last_name": "Leclerc",
    "dob": "1962-09-18",
    "citizenship_status": "PERM_RESIDENT",
    "ssn_masked": "XXX-XX-5194",
    "address": "5612 Birch Way, Phoenix, AZ 13423",
    "cosigner_notice_acknowledged": true
  },
  "credit_bureau": [
    {
      "subject_id": "BORR-00194",
      "subject_type": "borrower",
      "pull_date": "2026-08-15",
      "pull_type": "HARD",
      "fico_score": 744,
      "file_status": "ESTABLISHED",
      "oldest_tradeline_months": 194,
      "open_tradelines": 7,
      "total_debt": 80073.62,
      "revolving_utilization_pct": 0.27,
      "inquiries_6mo": 5,
      "delinq_30_24mo": 1,
      "delinq_60_24mo": 0,
      "delinq_90_24mo": 0,
      "collections_count": 0,
      "charge_offs_count": 0,
      "bankruptcy_flag": false,
      "bankruptcy_discharge_date": null,
      "student_loan_delinquency_flag": false
    },
    {
      "subject_id": "COSIG-00194",
      "subject_type": "cosigner",
      "pull_date": "2026-07-15",
      "pull_type": "HARD",
      "fico_score": 672,
      "file_status": "ESTABLISHED",
      "oldest_tradeline_months": 219,
      "open_tradelines": 10,
      "total_debt": 94513.82,
      "revolving_utilization_pct": 0.46,
      "inquiries_6mo": 1,
      "delinq_30_24mo": 0,
      "delinq_60_24mo": 0,
      "delinq_90_24mo": 0,
      "collections_count": 0,
      "charge_offs_count": 0,
      "bankruptcy_flag": false,
      "bankruptcy_discharge_date": null,
      "student_loan_delinquency_flag": false
    }
  ],
  "income_verification": [
    {
      "subject_id": "COSIG-00194",
      "verification_method": "TAX_RETURN",
      "employer_name": "Maple Street Capital",
      "employment_type": "SELF_EMPLOYED",
      "job_title": "Financial Analyst",
      "tenure_months": 148,
      "gross_annual_income": 97154.97,
      "other_income": 0,
      "other_income_source": null,
      "monthly_housing_expense": 883.92,
      "monthly_debt_service": 1762.87,
      "dti_pct": 0.2177,
      "residual_income": 6333.38,
      "docs_complete": true
    }
  ],
  "school": {
    "school_id": "SCH-020",
    "school_name": "Riverbend Career Institute",
    "school_type": "COMMUNITY",
    "title_iv_eligible": true,
    "accreditation_status": "NATIONAL",
    "on_approved_list": true,
    "cohort_default_rate_pct": 22.0,
    "completion_rate_pct": 38,
    "median_earnings_3yr_post": 25000,
    "school_risk_tier": "D",
    "country": "US"
  },
  "school_certification": {
    "certification_status": "RECEIVED",
    "certified_at": "2026-08-01",
    "cost_of_attendance": 23800.66,
    "other_financial_aid": 3516.59,
    "federal_loans_amount": 3707.67,
    "certified_max_eligible": 16576.4,
    "enrollment_period_start": "2027-01-10",
    "enrollment_period_end": "2028-01-10",
    "enrollment_intensity": "FULL_TIME",
    "degree_level": "BA",
    "program_name": "Nursing",
    "expected_graduation_date": "2031-05-15",
    "year_in_program": 1
  },
  "international_details": null,
  "existing_loans": null,
  "fraud_screening": {
    "kyc_status": "PASS",
    "cip_documents_verified": true,
    "ofac_hit": false,
    "device_risk_score": 12,
    "velocity_flag": false,
    "synthetic_identity_score": 13,
    "enrollment_fraud_flag": false,
    "address_mismatch_flag": false
  },
  "aggregate_exposure": {
    "prior_loans_with_us": 1,
    "prior_balance_with_us": 42009.64,
    "federal_loan_balance": 55697.89,
    "other_private_balance": 0,
    "total_education_debt": 154879.07,
    "projected_debt_at_graduation": 189181.99,
    "projected_starting_salary": 18231.79,
    "debt_to_projected_income_ratio": 10.3765
  },
  "decision": {
    "risk_grade": "A3",
    "decision": "DECLINE",
    "approved_amount": null,
    "offered_rate_pct": 6.99,
    "rate_type": "FIXED",
    "term_months": null,
    "repayment_option": null,
    "cosigner_release_eligible": null,
    "conditions": [],
    "decline_reason_codes": [
      "RC-010"
    ],
    "adverse_action_required": true,
    "decisioned_at": "2026-08-29T10:01:00",
    "decisioned_by": "AUTO"
  },
  "supplied_documents": [],
  "untrusted_applicant_text": null
}