{
  "application_id": "APP-2026-00079",
  "product_code": "SP",
  "submitted_at": "2026-08-11T14:16:00",
  "channel": "direct",
  "requested_amount": 17835.82,
  "loan_purpose": "professional_program_tuition",
  "state_of_residence": "NC",
  "has_cosigner": false,
  "status": "DECISIONED",
  "borrower": {
    "borrower_id": "BORR-00079",
    "first_name": "Mei",
    "last_name": "Sato",
    "dob": "1993-01-28",
    "age": 33,
    "ssn_itin_masked": "XXX-XX-0079",
    "email": "mei.sato79@example.com",
    "phone": "(490) 871-9492",
    "address_line1": "4612 Spruce Ct",
    "city": "Durham",
    "state": "NC",
    "zip": "83119",
    "citizenship_status": "US_CITIZEN",
    "years_at_address": 10,
    "references_provided": 2
  },
  "cosigner": null,
  "credit_bureau": [
    {
      "subject_id": "BORR-00079",
      "subject_type": "borrower",
      "pull_date": "2026-07-22",
      "pull_type": "HARD",
      "fico_score": null,
      "file_status": "THIN",
      "oldest_tradeline_months": 33,
      "open_tradelines": 0,
      "total_debt": 327.14,
      "revolving_utilization_pct": 0,
      "inquiries_6mo": 1,
      "delinq_30_24mo": 0,
      "delinq_60_24mo": 0,
      "delinq_90_24mo": 0,
      "collections_count": 0,
      "charge_offs_count": 0,
      "bankruptcy_flag": false,
      "bankruptcy_discharge_date": null,
      "student_loan_delinquency_flag": false
    }
  ],
  "income_verification": [
    {
      "subject_id": "BORR-00079",
      "verification_method": "VOE",
      "employer_name": "Crestview Medical Group",
      "employment_type": "SELF_EMPLOYED",
      "job_title": "Project Manager",
      "tenure_months": 109,
      "gross_annual_income": 110596.75,
      "other_income": 0,
      "other_income_source": null,
      "monthly_housing_expense": 893.33,
      "monthly_debt_service": 1273.25,
      "dti_pct": 0.1382,
      "residual_income": 7943.15,
      "docs_complete": true
    }
  ],
  "school": {
    "school_id": "SCH-030",
    "school_name": "Westfield School of Nursing",
    "school_type": "PROFESSIONAL",
    "title_iv_eligible": true,
    "accreditation_status": "CCNE",
    "on_approved_list": true,
    "cohort_default_rate_pct": 6.0,
    "completion_rate_pct": 80,
    "median_earnings_3yr_post": 72000,
    "school_risk_tier": "B",
    "country": "US"
  },
  "school_certification": {
    "certification_status": "RECEIVED",
    "certified_at": "2026-08-02",
    "cost_of_attendance": 52890.37,
    "other_financial_aid": 8153.45,
    "federal_loans_amount": 16917.76,
    "certified_max_eligible": 27819.16,
    "enrollment_period_start": "2026-08-15",
    "enrollment_period_end": "2027-08-15",
    "enrollment_intensity": "FULL_TIME",
    "degree_level": "PharmD",
    "program_name": "Dentistry",
    "expected_graduation_date": "2029-05-15",
    "year_in_program": 2
  },
  "international_details": null,
  "existing_loans": null,
  "fraud_screening": {
    "kyc_status": "PASS",
    "cip_documents_verified": true,
    "ofac_hit": false,
    "device_risk_score": 26,
    "velocity_flag": false,
    "synthetic_identity_score": 10,
    "enrollment_fraud_flag": false,
    "address_mismatch_flag": false
  },
  "aggregate_exposure": {
    "prior_loans_with_us": 2,
    "prior_balance_with_us": 8888.94,
    "federal_loan_balance": 45652.97,
    "other_private_balance": 0,
    "total_education_debt": 72377.73,
    "projected_debt_at_graduation": 83079.22,
    "projected_starting_salary": 82363.91,
    "debt_to_projected_income_ratio": 1.0087
  },
  "decision": {
    "risk_grade": "E1",
    "decision": "REFER_MANUAL",
    "approved_amount": 17835.82,
    "offered_rate_pct": null,
    "rate_type": null,
    "term_months": 180,
    "repayment_option": null,
    "cosigner_release_eligible": null,
    "conditions": [],
    "decline_reason_codes": [],
    "adverse_action_required": false,
    "decisioned_at": "2026-08-30T13:36:00",
    "decisioned_by": "ANALYST-431"
  },
  "supplied_documents": [],
  "untrusted_applicant_text": null
}