{
  "application_id": "APP-2026-00058",
  "product_code": "INTL",
  "submitted_at": "2026-07-22T13:39:00",
  "channel": "direct",
  "requested_amount": 20755.28,
  "loan_purpose": "international_education",
  "state_of_residence": "TN",
  "has_cosigner": false,
  "status": "DECISIONED",
  "borrower": {
    "borrower_id": "BORR-00058",
    "first_name": "Iris",
    "last_name": "Reyes",
    "dob": "2008-01-18",
    "age": 18,
    "ssn_itin_masked": "XXX-XX-0058",
    "email": "iris.reyes58@example.com",
    "phone": "(936) 749-3364",
    "address_line1": "7531 Cedar Way",
    "city": "Springfield",
    "state": "TN",
    "zip": "87649",
    "citizenship_status": "F1_VISA",
    "years_at_address": 0,
    "references_provided": 2
  },
  "cosigner": null,
  "credit_bureau": [
    {
      "subject_id": "BORR-00058",
      "subject_type": "borrower",
      "pull_date": "2026-07-05",
      "pull_type": "HARD",
      "fico_score": null,
      "file_status": "NO_FILE",
      "oldest_tradeline_months": null,
      "open_tradelines": null,
      "total_debt": null,
      "revolving_utilization_pct": null,
      "inquiries_6mo": 0,
      "delinq_30_24mo": 0,
      "delinq_60_24mo": 0,
      "delinq_90_24mo": 0,
      "collections_count": 0,
      "charge_offs_count": 0,
      "bankruptcy_flag": false,
      "bankruptcy_discharge_date": null,
      "student_loan_delinquency_flag": false
    }
  ],
  "income_verification": [],
  "school": {
    "school_id": "SCH-017",
    "school_name": "Prairie Heights University",
    "school_type": "PUBLIC_4YR",
    "title_iv_eligible": true,
    "accreditation_status": "REGIONAL",
    "on_approved_list": true,
    "cohort_default_rate_pct": 11.5,
    "completion_rate_pct": 58,
    "median_earnings_3yr_post": 34000,
    "school_risk_tier": "C",
    "country": "US"
  },
  "school_certification": {
    "certification_status": "RECEIVED",
    "certified_at": "2026-06-23",
    "cost_of_attendance": 69249.19,
    "other_financial_aid": 15558.44,
    "federal_loans_amount": 0,
    "certified_max_eligible": 53690.75,
    "enrollment_period_start": "2026-08-15",
    "enrollment_period_end": "2027-08-15",
    "enrollment_intensity": "FULL_TIME",
    "degree_level": "BS",
    "program_name": "Electrical Eng",
    "expected_graduation_date": "2028-05-15",
    "year_in_program": 3
  },
  "international_details": {
    "visa_type": "F-1",
    "i20_ds2019_number": "N6918279244",
    "i94_verified": true,
    "passport_country": "Colombia",
    "home_country_credit_available": true,
    "home_country_reference_provided": true,
    "sponsor_funds_documented": false,
    "opt_eligible": true,
    "stem_opt_eligible": false,
    "post_study_work_months": 12
  },
  "existing_loans": null,
  "fraud_screening": {
    "kyc_status": "PASS",
    "cip_documents_verified": true,
    "ofac_hit": false,
    "device_risk_score": 34,
    "velocity_flag": false,
    "synthetic_identity_score": 11,
    "enrollment_fraud_flag": false,
    "address_mismatch_flag": false
  },
  "aggregate_exposure": {
    "prior_loans_with_us": 0,
    "prior_balance_with_us": 0,
    "federal_loan_balance": 0,
    "other_private_balance": 0,
    "total_education_debt": 20755.28,
    "projected_debt_at_graduation": 26981.86,
    "projected_starting_salary": 24555.44,
    "debt_to_projected_income_ratio": 1.0988
  },
  "decision": {
    "risk_grade": "E1",
    "decision": "DECLINE",
    "approved_amount": null,
    "offered_rate_pct": null,
    "rate_type": null,
    "term_months": null,
    "repayment_option": null,
    "cosigner_release_eligible": null,
    "conditions": [],
    "decline_reason_codes": [
      "RC-015"
    ],
    "adverse_action_required": true,
    "decisioned_at": "2026-08-23T13:32:00",
    "decisioned_by": "AUTO"
  },
  "supplied_documents": [],
  "untrusted_applicant_text": null
}