{
  "application_id": "APP-2026-00189",
  "product_code": "GR",
  "submitted_at": "2026-07-14T16:05:00",
  "channel": "direct",
  "requested_amount": 20388.24,
  "loan_purpose": "graduate_tuition",
  "state_of_residence": "AZ",
  "has_cosigner": true,
  "status": "DECISIONED",
  "borrower": {
    "borrower_id": "BORR-00189",
    "first_name": "Blake",
    "last_name": "Okafor",
    "dob": "1999-05-04",
    "age": 27,
    "ssn_itin_masked": "XXX-XX-0189",
    "email": "blake.okafor189@example.com",
    "phone": "(320) 873-3635",
    "address_line1": "8042 Walnut Blvd",
    "city": "Tucson",
    "state": "AZ",
    "zip": "66100",
    "citizenship_status": "US_CITIZEN",
    "years_at_address": 4,
    "references_provided": 3
  },
  "cosigner": {
    "cosigner_id": "COSIG-00189",
    "borrower_id": "BORR-00189",
    "relationship": "other",
    "first_name": "Yosef",
    "last_name": "Delacroix",
    "dob": "1982-12-15",
    "citizenship_status": "US_CITIZEN",
    "ssn_masked": "XXX-XX-5189",
    "address": "527 Cedar Ave, Springfield, MN 74215",
    "cosigner_notice_acknowledged": true
  },
  "credit_bureau": [
    {
      "subject_id": "BORR-00189",
      "subject_type": "borrower",
      "pull_date": "2026-07-06",
      "pull_type": "HARD",
      "fico_score": 668,
      "file_status": "ESTABLISHED",
      "oldest_tradeline_months": 138,
      "open_tradelines": 6,
      "total_debt": 26131.99,
      "revolving_utilization_pct": 0.22,
      "inquiries_6mo": 0,
      "delinq_30_24mo": 0,
      "delinq_60_24mo": 0,
      "delinq_90_24mo": 0,
      "collections_count": 0,
      "charge_offs_count": 0,
      "bankruptcy_flag": false,
      "bankruptcy_discharge_date": null,
      "student_loan_delinquency_flag": false
    },
    {
      "subject_id": "COSIG-00189",
      "subject_type": "cosigner",
      "pull_date": "2026-07-25",
      "pull_type": "HARD",
      "fico_score": 845,
      "file_status": "ESTABLISHED",
      "oldest_tradeline_months": 350,
      "open_tradelines": 3,
      "total_debt": 73436.29,
      "revolving_utilization_pct": 0.34,
      "inquiries_6mo": 0,
      "delinq_30_24mo": 0,
      "delinq_60_24mo": 0,
      "delinq_90_24mo": 0,
      "collections_count": 0,
      "charge_offs_count": 0,
      "bankruptcy_flag": false,
      "bankruptcy_discharge_date": null,
      "student_loan_delinquency_flag": false
    }
  ],
  "income_verification": [
    {
      "subject_id": "BORR-00189",
      "verification_method": "VOE",
      "employer_name": "Pinnacle Ridge Technologies",
      "employment_type": "CONTRACT",
      "job_title": "Accountant",
      "tenure_months": 54,
      "gross_annual_income": 57905.84,
      "other_income": 0,
      "other_income_source": null,
      "monthly_housing_expense": 1158.52,
      "monthly_debt_service": 1602.07,
      "dti_pct": 0.332,
      "residual_income": 3223.42,
      "docs_complete": false
    },
    {
      "subject_id": "COSIG-00189",
      "verification_method": "TAX_RETURN",
      "employer_name": "Maple Street Capital",
      "employment_type": "W2",
      "job_title": "Project Manager",
      "tenure_months": 208,
      "gross_annual_income": 91585.99,
      "other_income": 0,
      "other_income_source": null,
      "monthly_housing_expense": 1361.72,
      "monthly_debt_service": 1970.89,
      "dti_pct": 0.2582,
      "residual_income": 5661.28,
      "docs_complete": true
    }
  ],
  "school": {
    "school_id": "SCH-001",
    "school_name": "Crestmont University",
    "school_type": "PUBLIC_4YR",
    "title_iv_eligible": true,
    "accreditation_status": "REGIONAL",
    "on_approved_list": true,
    "cohort_default_rate_pct": 3.2,
    "completion_rate_pct": 85,
    "median_earnings_3yr_post": 58000,
    "school_risk_tier": "A",
    "country": "US"
  },
  "school_certification": {
    "certification_status": "RECEIVED",
    "certified_at": "2026-07-31",
    "cost_of_attendance": 17889.72,
    "other_financial_aid": 4536.54,
    "federal_loans_amount": 9347.23,
    "certified_max_eligible": 4005.95,
    "enrollment_period_start": "2027-01-10",
    "enrollment_period_end": "2028-01-10",
    "enrollment_intensity": "FULL_TIME",
    "degree_level": "MS",
    "program_name": "Public Health",
    "expected_graduation_date": "2029-05-15",
    "year_in_program": 2
  },
  "international_details": null,
  "existing_loans": null,
  "fraud_screening": {
    "kyc_status": "PASS",
    "cip_documents_verified": true,
    "ofac_hit": false,
    "device_risk_score": 29,
    "velocity_flag": false,
    "synthetic_identity_score": 25,
    "enrollment_fraud_flag": false,
    "address_mismatch_flag": false
  },
  "aggregate_exposure": {
    "prior_loans_with_us": 0,
    "prior_balance_with_us": 0,
    "federal_loan_balance": 56853.02,
    "other_private_balance": 24419.02,
    "total_education_debt": 101660.28,
    "projected_debt_at_graduation": 113893.22,
    "projected_starting_salary": 61194.26,
    "debt_to_projected_income_ratio": 1.8612
  },
  "decision": {
    "risk_grade": "C1",
    "decision": "APPROVE_WITH_CONDITIONS",
    "approved_amount": 4005.95,
    "offered_rate_pct": 7.99,
    "rate_type": "VARIABLE",
    "term_months": 120,
    "repayment_option": "FLAT_25",
    "cosigner_release_eligible": true,
    "conditions": [
      "Amount capped at certified maximum eligible"
    ],
    "decline_reason_codes": [],
    "adverse_action_required": true,
    "decisioned_at": "2026-08-10T17:39:00",
    "decisioned_by": "ANALYST-108"
  },
  "supplied_documents": [],
  "untrusted_applicant_text": null
}