{
  "application_id": "APP-2026-00028",
  "product_code": "UG",
  "submitted_at": "2026-07-23T12:41:00",
  "channel": "direct",
  "requested_amount": 20205.66,
  "loan_purpose": "undergraduate_tuition",
  "state_of_residence": "WA",
  "has_cosigner": true,
  "status": "DECISIONED",
  "borrower": {
    "borrower_id": "BORR-00028",
    "first_name": "Theo",
    "last_name": "Ueda",
    "dob": "2006-02-16",
    "age": 20,
    "ssn_itin_masked": "XXX-XX-0028",
    "email": "theo.ueda28@example.com",
    "phone": "(716) 746-2592",
    "address_line1": "3123 Maple Blvd",
    "city": "Seattle",
    "state": "WA",
    "zip": "86010",
    "citizenship_status": "PERM_RESIDENT",
    "years_at_address": 0,
    "references_provided": 1
  },
  "cosigner": {
    "cosigner_id": "COSIG-00028",
    "borrower_id": "BORR-00028",
    "relationship": "other",
    "first_name": "Iris",
    "last_name": "Fujimoto",
    "dob": "1985-11-23",
    "citizenship_status": "US_CITIZEN",
    "ssn_masked": "XXX-XX-5028",
    "address": "1223 Pine Way, Springfield, MD 39166",
    "cosigner_notice_acknowledged": true
  },
  "credit_bureau": [
    {
      "subject_id": "BORR-00028",
      "subject_type": "borrower",
      "pull_date": "2026-08-13",
      "pull_type": "HARD",
      "fico_score": null,
      "file_status": "NO_FILE",
      "oldest_tradeline_months": null,
      "open_tradelines": null,
      "total_debt": null,
      "revolving_utilization_pct": null,
      "inquiries_6mo": 0,
      "delinq_30_24mo": 0,
      "delinq_60_24mo": 0,
      "delinq_90_24mo": 0,
      "collections_count": 0,
      "charge_offs_count": 0,
      "bankruptcy_flag": false,
      "bankruptcy_discharge_date": null,
      "student_loan_delinquency_flag": false
    },
    {
      "subject_id": "COSIG-00028",
      "subject_type": "cosigner",
      "pull_date": "2026-07-12",
      "pull_type": "HARD",
      "fico_score": 742,
      "file_status": "ESTABLISHED",
      "oldest_tradeline_months": 177,
      "open_tradelines": 10,
      "total_debt": 2280.08,
      "revolving_utilization_pct": 0.72,
      "inquiries_6mo": 0,
      "delinq_30_24mo": 0,
      "delinq_60_24mo": 0,
      "delinq_90_24mo": 0,
      "collections_count": 0,
      "charge_offs_count": 0,
      "bankruptcy_flag": false,
      "bankruptcy_discharge_date": null,
      "student_loan_delinquency_flag": false
    }
  ],
  "income_verification": [
    {
      "subject_id": "COSIG-00028",
      "verification_method": "PAYSTUB",
      "employer_name": "Horizon Cloud Services",
      "employment_type": "SELF_EMPLOYED",
      "job_title": "Registered Nurse",
      "tenure_months": 184,
      "gross_annual_income": 191594.0,
      "other_income": 0,
      "other_income_source": null,
      "monthly_housing_expense": 711.12,
      "monthly_debt_service": 2398.04,
      "dti_pct": 0.1502,
      "residual_income": 13568.13,
      "docs_complete": true
    }
  ],
  "school": {
    "school_id": "SCH-008",
    "school_name": "Maplewood College",
    "school_type": "PRIVATE_4YR",
    "title_iv_eligible": true,
    "accreditation_status": "REGIONAL",
    "on_approved_list": true,
    "cohort_default_rate_pct": 7.1,
    "completion_rate_pct": 72,
    "median_earnings_3yr_post": 45000,
    "school_risk_tier": "B",
    "country": "US"
  },
  "school_certification": {
    "certification_status": "RECEIVED",
    "certified_at": "2026-06-01",
    "cost_of_attendance": 45482.07,
    "other_financial_aid": 5927.69,
    "federal_loans_amount": 4755.64,
    "certified_max_eligible": 34798.74,
    "enrollment_period_start": "2026-08-15",
    "enrollment_period_end": "2027-08-15",
    "enrollment_intensity": "FULL_TIME",
    "degree_level": "AS",
    "program_name": "Engineering",
    "expected_graduation_date": "2028-05-15",
    "year_in_program": 4
  },
  "international_details": null,
  "existing_loans": null,
  "fraud_screening": {
    "kyc_status": "PASS",
    "cip_documents_verified": true,
    "ofac_hit": false,
    "device_risk_score": 24,
    "velocity_flag": false,
    "synthetic_identity_score": 24,
    "enrollment_fraud_flag": false,
    "address_mismatch_flag": false
  },
  "aggregate_exposure": {
    "prior_loans_with_us": 2,
    "prior_balance_with_us": 10994.68,
    "federal_loan_balance": 27503.35,
    "other_private_balance": 0,
    "total_education_debt": 58703.69,
    "projected_debt_at_graduation": 76888.78,
    "projected_starting_salary": 39667.84,
    "debt_to_projected_income_ratio": 1.9383
  },
  "decision": {
    "risk_grade": "A3",
    "decision": "APPROVE",
    "approved_amount": 20205.66,
    "offered_rate_pct": 5.99,
    "rate_type": "FIXED",
    "term_months": 84,
    "repayment_option": "INTEREST_ONLY",
    "cosigner_release_eligible": true,
    "conditions": [],
    "decline_reason_codes": [],
    "adverse_action_required": false,
    "decisioned_at": "2026-08-26T15:08:00",
    "decisioned_by": "AUTO"
  },
  "supplied_documents": [],
  "untrusted_applicant_text": null
}