{
  "application_id": "APP-2026-00126",
  "product_code": "UG",
  "submitted_at": "2026-09-01T16:25:00",
  "channel": "school_referral",
  "requested_amount": 5750.15,
  "loan_purpose": "undergraduate_tuition",
  "state_of_residence": "AL",
  "has_cosigner": true,
  "status": "DECISIONED",
  "borrower": {
    "borrower_id": "BORR-00126",
    "first_name": "Aiden",
    "last_name": "Espinoza",
    "dob": "2008-09-11",
    "age": 18,
    "ssn_itin_masked": "XXX-XX-0126",
    "email": "aiden.espinoza126@example.com",
    "phone": "(351) 959-5586",
    "address_line1": "6597 Maple Ave",
    "city": "Springfield",
    "state": "AL",
    "zip": "71852",
    "citizenship_status": "US_CITIZEN",
    "years_at_address": 0,
    "references_provided": 0
  },
  "cosigner": {
    "cosigner_id": "COSIG-00126",
    "borrower_id": "BORR-00126",
    "relationship": "parent",
    "first_name": "Leon",
    "last_name": "Leclerc",
    "dob": "1990-06-01",
    "citizenship_status": "US_CITIZEN",
    "ssn_masked": "XXX-XX-5126",
    "address": "425 Spruce Ln, Durham, NC 87458",
    "cosigner_notice_acknowledged": false
  },
  "credit_bureau": [
    {
      "subject_id": "BORR-00126",
      "subject_type": "borrower",
      "pull_date": "2026-07-18",
      "pull_type": "HARD",
      "fico_score": null,
      "file_status": "NO_FILE",
      "oldest_tradeline_months": null,
      "open_tradelines": null,
      "total_debt": null,
      "revolving_utilization_pct": null,
      "inquiries_6mo": 0,
      "delinq_30_24mo": 0,
      "delinq_60_24mo": 0,
      "delinq_90_24mo": 0,
      "collections_count": 0,
      "charge_offs_count": 0,
      "bankruptcy_flag": false,
      "bankruptcy_discharge_date": null,
      "student_loan_delinquency_flag": false
    },
    {
      "subject_id": "COSIG-00126",
      "subject_type": "cosigner",
      "pull_date": "2026-08-04",
      "pull_type": "HARD",
      "fico_score": 673,
      "file_status": "ESTABLISHED",
      "oldest_tradeline_months": 194,
      "open_tradelines": 15,
      "total_debt": 8598.94,
      "revolving_utilization_pct": 0.57,
      "inquiries_6mo": 2,
      "delinq_30_24mo": 1,
      "delinq_60_24mo": 0,
      "delinq_90_24mo": 0,
      "collections_count": 0,
      "charge_offs_count": 0,
      "bankruptcy_flag": false,
      "bankruptcy_discharge_date": null,
      "student_loan_delinquency_flag": false
    }
  ],
  "income_verification": [
    {
      "subject_id": "COSIG-00126",
      "verification_method": "PAYSTUB",
      "employer_name": "Prairie Wind Energy",
      "employment_type": "W2",
      "job_title": "Software Engineer",
      "tenure_months": 72,
      "gross_annual_income": 177784.59,
      "other_income": 0,
      "other_income_source": null,
      "monthly_housing_expense": 2351.11,
      "monthly_debt_service": 3479.76,
      "dti_pct": 0.2349,
      "residual_income": 11335.62,
      "docs_complete": true
    }
  ],
  "school": {
    "school_id": "SCH-003",
    "school_name": "Ridgeline College",
    "school_type": "PRIVATE_4YR",
    "title_iv_eligible": true,
    "accreditation_status": "REGIONAL",
    "on_approved_list": true,
    "cohort_default_rate_pct": 2.8,
    "completion_rate_pct": 88,
    "median_earnings_3yr_post": 62000,
    "school_risk_tier": "A",
    "country": "US"
  },
  "school_certification": {
    "certification_status": "RECEIVED",
    "certified_at": "2026-06-11",
    "cost_of_attendance": 41285.22,
    "other_financial_aid": 14610.38,
    "federal_loans_amount": 5097.48,
    "certified_max_eligible": 21577.36,
    "enrollment_period_start": "2027-01-10",
    "enrollment_period_end": "2028-01-10",
    "enrollment_intensity": "FULL_TIME",
    "degree_level": "AS",
    "program_name": "Biology",
    "expected_graduation_date": "2030-05-15",
    "year_in_program": 2
  },
  "international_details": null,
  "existing_loans": null,
  "fraud_screening": {
    "kyc_status": "PASS",
    "cip_documents_verified": true,
    "ofac_hit": false,
    "device_risk_score": 31,
    "velocity_flag": false,
    "synthetic_identity_score": 12,
    "enrollment_fraud_flag": false,
    "address_mismatch_flag": false
  },
  "aggregate_exposure": {
    "prior_loans_with_us": 1,
    "prior_balance_with_us": 32757.9,
    "federal_loan_balance": 35478.78,
    "other_private_balance": 0,
    "total_education_debt": 73986.83,
    "projected_debt_at_graduation": 77436.92,
    "projected_starting_salary": 53790.66,
    "debt_to_projected_income_ratio": 1.4396
  },
  "decision": {
    "risk_grade": "C1",
    "decision": "APPROVE",
    "approved_amount": 5750.15,
    "offered_rate_pct": 7.99,
    "rate_type": "FIXED",
    "term_months": 60,
    "repayment_option": "DEFERRED",
    "cosigner_release_eligible": true,
    "conditions": [],
    "decline_reason_codes": [],
    "adverse_action_required": false,
    "decisioned_at": "2026-08-09T16:47:00",
    "decisioned_by": "AUTO"
  },
  "supplied_documents": [],
  "untrusted_applicant_text": null
}