{
  "application_id": "APP-2026-00168",
  "product_code": "INTL",
  "submitted_at": "2026-08-05T09:01:00",
  "channel": "direct",
  "requested_amount": 16494.54,
  "loan_purpose": "international_education",
  "state_of_residence": "NJ",
  "has_cosigner": false,
  "status": "DECISIONED",
  "borrower": {
    "borrower_id": "BORR-00168",
    "first_name": "Victor",
    "last_name": "Zamora",
    "dob": "1997-05-23",
    "age": 29,
    "ssn_itin_masked": "XXX-XX-0168",
    "email": "victor.zamora168@example.com",
    "phone": "(670) 478-2822",
    "address_line1": "8099 Spruce Blvd",
    "city": "Springfield",
    "state": "NJ",
    "zip": "88726",
    "citizenship_status": "J1_VISA",
    "years_at_address": 7,
    "references_provided": 0
  },
  "cosigner": null,
  "credit_bureau": [
    {
      "subject_id": "BORR-00168",
      "subject_type": "borrower",
      "pull_date": "2026-08-09",
      "pull_type": "HARD",
      "fico_score": null,
      "file_status": "NO_FILE",
      "oldest_tradeline_months": null,
      "open_tradelines": null,
      "total_debt": null,
      "revolving_utilization_pct": null,
      "inquiries_6mo": 0,
      "delinq_30_24mo": 0,
      "delinq_60_24mo": 0,
      "delinq_90_24mo": 0,
      "collections_count": 0,
      "charge_offs_count": 0,
      "bankruptcy_flag": false,
      "bankruptcy_discharge_date": null,
      "student_loan_delinquency_flag": false
    }
  ],
  "income_verification": [],
  "school": {
    "school_id": "SCH-035",
    "school_name": "Pacific Rim Business School",
    "school_type": "INTERNATIONAL_ELIGIBLE",
    "title_iv_eligible": false,
    "accreditation_status": "AACSB",
    "on_approved_list": true,
    "cohort_default_rate_pct": 6.5,
    "completion_rate_pct": 78,
    "median_earnings_3yr_post": 52000,
    "school_risk_tier": "B",
    "country": "Singapore"
  },
  "school_certification": {
    "certification_status": "RECEIVED",
    "certified_at": "2026-07-13",
    "cost_of_attendance": 28644.34,
    "other_financial_aid": 4471.5,
    "federal_loans_amount": 0,
    "certified_max_eligible": 24172.84,
    "enrollment_period_start": "2027-01-10",
    "enrollment_period_end": "2028-01-10",
    "enrollment_intensity": "FULL_TIME",
    "degree_level": "MS",
    "program_name": "Data Science",
    "expected_graduation_date": "2028-05-15",
    "year_in_program": 3
  },
  "international_details": {
    "visa_type": "J-1",
    "i20_ds2019_number": "N8709291701",
    "i94_verified": true,
    "passport_country": "Mexico",
    "home_country_credit_available": false,
    "home_country_reference_provided": true,
    "sponsor_funds_documented": true,
    "opt_eligible": false,
    "stem_opt_eligible": false,
    "post_study_work_months": 11
  },
  "existing_loans": null,
  "fraud_screening": {
    "kyc_status": "PASS",
    "cip_documents_verified": true,
    "ofac_hit": false,
    "device_risk_score": 82,
    "velocity_flag": false,
    "synthetic_identity_score": 80,
    "enrollment_fraud_flag": false,
    "address_mismatch_flag": false
  },
  "aggregate_exposure": {
    "prior_loans_with_us": 2,
    "prior_balance_with_us": 7450.25,
    "federal_loan_balance": 0,
    "other_private_balance": 0,
    "total_education_debt": 23944.79,
    "projected_debt_at_graduation": 33841.51,
    "projected_starting_salary": 43043.03,
    "debt_to_projected_income_ratio": 0.7862
  },
  "decision": {
    "risk_grade": "E1",
    "decision": "DECLINE",
    "approved_amount": null,
    "offered_rate_pct": null,
    "rate_type": null,
    "term_months": null,
    "repayment_option": null,
    "cosigner_release_eligible": null,
    "conditions": [],
    "decline_reason_codes": [
      "RC-015"
    ],
    "adverse_action_required": true,
    "decisioned_at": "2026-08-15T16:02:00",
    "decisioned_by": "AUTO"
  },
  "supplied_documents": [],
  "untrusted_applicant_text": null
}