{
  "application_id": "APP-2026-00068",
  "product_code": "UG",
  "submitted_at": "2026-08-09T10:49:00",
  "channel": "partner",
  "requested_amount": 53198.93,
  "loan_purpose": "undergraduate_tuition",
  "state_of_residence": "CT",
  "has_cosigner": true,
  "status": "DECISIONED",
  "borrower": {
    "borrower_id": "BORR-00068",
    "first_name": "Victor",
    "last_name": "Brennan",
    "dob": "2009-07-17",
    "age": 17,
    "ssn_itin_masked": "XXX-XX-0068",
    "email": "victor.brennan68@example.com",
    "phone": "(469) 901-7501",
    "address_line1": "895 Willow Ln",
    "city": "Springfield",
    "state": "CT",
    "zip": "65504",
    "citizenship_status": "US_CITIZEN",
    "years_at_address": 0,
    "references_provided": 3
  },
  "cosigner": {
    "cosigner_id": "COSIG-00068",
    "borrower_id": "BORR-00068",
    "relationship": "relative",
    "first_name": "Gavin",
    "last_name": "Xu",
    "dob": "1963-08-07",
    "citizenship_status": "US_CITIZEN",
    "ssn_masked": "XXX-XX-5068",
    "address": "9408 Oak Ct, Springfield, SC 53594",
    "cosigner_notice_acknowledged": true
  },
  "credit_bureau": [
    {
      "subject_id": "BORR-00068",
      "subject_type": "borrower",
      "pull_date": "2026-07-22",
      "pull_type": "HARD",
      "fico_score": null,
      "file_status": "NO_FILE",
      "oldest_tradeline_months": null,
      "open_tradelines": null,
      "total_debt": null,
      "revolving_utilization_pct": null,
      "inquiries_6mo": 0,
      "delinq_30_24mo": 0,
      "delinq_60_24mo": 0,
      "delinq_90_24mo": 0,
      "collections_count": 0,
      "charge_offs_count": 0,
      "bankruptcy_flag": false,
      "bankruptcy_discharge_date": null,
      "student_loan_delinquency_flag": false
    },
    {
      "subject_id": "COSIG-00068",
      "subject_type": "cosigner",
      "pull_date": "2026-07-31",
      "pull_type": "HARD",
      "fico_score": 741,
      "file_status": "ESTABLISHED",
      "oldest_tradeline_months": 69,
      "open_tradelines": 11,
      "total_debt": 30995.09,
      "revolving_utilization_pct": 0.58,
      "inquiries_6mo": 4,
      "delinq_30_24mo": 0,
      "delinq_60_24mo": 0,
      "delinq_90_24mo": 0,
      "collections_count": 0,
      "charge_offs_count": 0,
      "bankruptcy_flag": false,
      "bankruptcy_discharge_date": null,
      "student_loan_delinquency_flag": false
    }
  ],
  "income_verification": [
    {
      "subject_id": "COSIG-00068",
      "verification_method": "TAX_RETURN",
      "employer_name": "Ironbridge Manufacturing",
      "employment_type": "SELF_EMPLOYED",
      "job_title": "Data Analyst",
      "tenure_months": 122,
      "gross_annual_income": 207782.99,
      "other_income": 0,
      "other_income_source": null,
      "monthly_housing_expense": 1306.3,
      "monthly_debt_service": 2769.04,
      "dti_pct": 0.1599,
      "residual_income": 14546.21,
      "docs_complete": true
    }
  ],
  "school": {
    "school_id": "SCH-017",
    "school_name": "Prairie Heights University",
    "school_type": "PUBLIC_4YR",
    "title_iv_eligible": true,
    "accreditation_status": "REGIONAL",
    "on_approved_list": true,
    "cohort_default_rate_pct": 11.5,
    "completion_rate_pct": 58,
    "median_earnings_3yr_post": 34000,
    "school_risk_tier": "C",
    "country": "US"
  },
  "school_certification": {
    "certification_status": "RECEIVED",
    "certified_at": "2026-07-24",
    "cost_of_attendance": 36335.31,
    "other_financial_aid": 1534.29,
    "federal_loans_amount": 3670.58,
    "certified_max_eligible": 31130.44,
    "enrollment_period_start": "2026-08-15",
    "enrollment_period_end": "2027-08-15",
    "enrollment_intensity": "FULL_TIME",
    "degree_level": "BS",
    "program_name": "Business",
    "expected_graduation_date": "2028-05-15",
    "year_in_program": 1
  },
  "international_details": null,
  "existing_loans": null,
  "fraud_screening": {
    "kyc_status": "PASS",
    "cip_documents_verified": true,
    "ofac_hit": false,
    "device_risk_score": 28,
    "velocity_flag": false,
    "synthetic_identity_score": 11,
    "enrollment_fraud_flag": false,
    "address_mismatch_flag": false
  },
  "aggregate_exposure": {
    "prior_loans_with_us": 0,
    "prior_balance_with_us": 0,
    "federal_loan_balance": 10690.91,
    "other_private_balance": 21750.78,
    "total_education_debt": 85640.62,
    "projected_debt_at_graduation": 101600.3,
    "projected_starting_salary": 31449.61,
    "debt_to_projected_income_ratio": 3.2306
  },
  "decision": {
    "risk_grade": "A3",
    "decision": "APPROVE_WITH_CONDITIONS",
    "approved_amount": 31130.44,
    "offered_rate_pct": 6.49,
    "rate_type": "VARIABLE",
    "term_months": 60,
    "repayment_option": "DEFERRED",
    "cosigner_release_eligible": true,
    "conditions": [
      "Amount capped at certified maximum eligible"
    ],
    "decline_reason_codes": [],
    "adverse_action_required": true,
    "decisioned_at": "2026-08-29T12:12:00",
    "decisioned_by": "ANALYST-281"
  },
  "supplied_documents": [],
  "untrusted_applicant_text": null
}