{
  "application_id": "APP-2026-00074",
  "product_code": "GR",
  "submitted_at": "2026-08-18T13:11:00",
  "channel": "school_referral",
  "requested_amount": 64844.6,
  "loan_purpose": "graduate_tuition",
  "state_of_residence": "AZ",
  "has_cosigner": true,
  "status": "DECISIONED",
  "borrower": {
    "borrower_id": "BORR-00074",
    "first_name": "Lina",
    "last_name": "Morales",
    "dob": "2004-04-10",
    "age": 22,
    "ssn_itin_masked": "XXX-XX-0074",
    "email": "lina.morales74@example.com",
    "phone": "(496) 373-3801",
    "address_line1": "6417 Maple Dr",
    "city": "Phoenix",
    "state": "AZ",
    "zip": "79468",
    "citizenship_status": "US_CITIZEN",
    "years_at_address": 5,
    "references_provided": 1
  },
  "cosigner": {
    "cosigner_id": "COSIG-00074",
    "borrower_id": "BORR-00074",
    "relationship": "spouse",
    "first_name": "Olivia",
    "last_name": "Bhatti",
    "dob": "1976-01-05",
    "citizenship_status": "US_CITIZEN",
    "ssn_masked": "XXX-XX-5074",
    "address": "437 Spruce St, Springfield, IN 20957",
    "cosigner_notice_acknowledged": true
  },
  "credit_bureau": [
    {
      "subject_id": "BORR-00074",
      "subject_type": "borrower",
      "pull_date": "2026-07-04",
      "pull_type": "HARD",
      "fico_score": 722,
      "file_status": "ESTABLISHED",
      "oldest_tradeline_months": 325,
      "open_tradelines": 6,
      "total_debt": 3839.47,
      "revolving_utilization_pct": 0.42,
      "inquiries_6mo": 4,
      "delinq_30_24mo": 0,
      "delinq_60_24mo": 0,
      "delinq_90_24mo": 0,
      "collections_count": 0,
      "charge_offs_count": 0,
      "bankruptcy_flag": false,
      "bankruptcy_discharge_date": null,
      "student_loan_delinquency_flag": false
    },
    {
      "subject_id": "COSIG-00074",
      "subject_type": "cosigner",
      "pull_date": "2026-08-09",
      "pull_type": "HARD",
      "fico_score": 672,
      "file_status": "ESTABLISHED",
      "oldest_tradeline_months": 290,
      "open_tradelines": 10,
      "total_debt": 50686.53,
      "revolving_utilization_pct": 0.21,
      "inquiries_6mo": 0,
      "delinq_30_24mo": 1,
      "delinq_60_24mo": 0,
      "delinq_90_24mo": 0,
      "collections_count": 0,
      "charge_offs_count": 0,
      "bankruptcy_flag": false,
      "bankruptcy_discharge_date": null,
      "student_loan_delinquency_flag": false
    }
  ],
  "income_verification": [
    {
      "subject_id": "BORR-00074",
      "verification_method": "PAYSTUB",
      "employer_name": "Northwind Analytics",
      "employment_type": "W2",
      "job_title": "Registered Nurse",
      "tenure_months": 13,
      "gross_annual_income": 68949.78,
      "other_income": 11985.2,
      "other_income_source": "Alimony",
      "monthly_housing_expense": 1150.13,
      "monthly_debt_service": 2142.96,
      "dti_pct": 0.3177,
      "residual_income": 4601.62,
      "docs_complete": true
    },
    {
      "subject_id": "COSIG-00074",
      "verification_method": "W2",
      "employer_name": "Birchwood Retail",
      "employment_type": "W2",
      "job_title": "HR Coordinator",
      "tenure_months": 70,
      "gross_annual_income": 70132.32,
      "other_income": 0,
      "other_income_source": null,
      "monthly_housing_expense": 904.38,
      "monthly_debt_service": 1966.82,
      "dti_pct": 0.3365,
      "residual_income": 3877.54,
      "docs_complete": true
    }
  ],
  "school": {
    "school_id": "SCH-002",
    "school_name": "Harborview State University",
    "school_type": "PUBLIC_4YR",
    "title_iv_eligible": true,
    "accreditation_status": "REGIONAL",
    "on_approved_list": true,
    "cohort_default_rate_pct": 4.1,
    "completion_rate_pct": 82,
    "median_earnings_3yr_post": 55000,
    "school_risk_tier": "A",
    "country": "US"
  },
  "school_certification": {
    "certification_status": "RECEIVED",
    "certified_at": "2026-06-19",
    "cost_of_attendance": 37806.45,
    "other_financial_aid": 10080.81,
    "federal_loans_amount": 18167.77,
    "certified_max_eligible": 9557.87,
    "enrollment_period_start": "2027-01-10",
    "enrollment_period_end": "2028-01-10",
    "enrollment_intensity": "FULL_TIME",
    "degree_level": "MA",
    "program_name": "Public Health",
    "expected_graduation_date": "2031-05-15",
    "year_in_program": 1
  },
  "international_details": null,
  "existing_loans": null,
  "fraud_screening": {
    "kyc_status": "PASS",
    "cip_documents_verified": true,
    "ofac_hit": false,
    "device_risk_score": 32,
    "velocity_flag": false,
    "synthetic_identity_score": 17,
    "enrollment_fraud_flag": false,
    "address_mismatch_flag": false
  },
  "aggregate_exposure": {
    "prior_loans_with_us": 0,
    "prior_balance_with_us": 0,
    "federal_loan_balance": 39891.34,
    "other_private_balance": 0,
    "total_education_debt": 104735.94,
    "projected_debt_at_graduation": 104735.94,
    "projected_starting_salary": 45915.92,
    "debt_to_projected_income_ratio": 2.281
  },
  "decision": {
    "risk_grade": "B1",
    "decision": "APPROVE_WITH_CONDITIONS",
    "approved_amount": 9557.87,
    "offered_rate_pct": 6.49,
    "rate_type": "FIXED",
    "term_months": 120,
    "repayment_option": "DEFERRED",
    "cosigner_release_eligible": true,
    "conditions": [
      "Amount capped at certified maximum eligible"
    ],
    "decline_reason_codes": [],
    "adverse_action_required": true,
    "decisioned_at": "2026-09-10T14:06:00",
    "decisioned_by": "ANALYST-388"
  },
  "supplied_documents": [],
  "untrusted_applicant_text": null
}